{
  "schemaVersion": "1",
  "type": "social_post",
  "author": {
    "name": "城市观察者",
    "handle": "@city-watcher"
  },
  "content": "如果把一天拆成很多个小片段，就会发现真正留下来的并不是某一个宏大的结论，而是路边突然亮起来的灯、朋友说完之后大家一起笑的几秒钟、以及在忙乱中仍然愿意认真完成的一件小事。记录这些瞬间，不是为了给生活增加负担，而是提醒自己：我们确实来过这里，也确实感受过这些微小但清晰的快乐。\n\n这条内容故意保留较长篇幅，用于验证统一卡片在不同屏幕尺寸下的折行和纵向节奏。",
  "publishedAt": "2026-09-03 08:15"
}
