{
  "schemaVersion": "1",
  "type": "social_post",
  "postKind": "reply",
  "author": {
    "name": "Current Author",
    "handle": "current"
  },
  "content": "补充当前回复。",
  "publishedAt": "2026-08-31 20:00",
  "replyChain": [
    {
      "author": {
        "name": "First Reply",
        "handle": "@first-reply"
      },
      "content": "这个角度很有意思。",
      "publishedAt": "2026-08-31 18:20"
    },
    {
      "author": {
        "name": "Second Reply",
        "handle": "@second-reply",
        "verified": true
      },
      "content": "尤其是最后一句，值得再读一遍。",
      "media": [
        {
          "type": "gif",
          "url": "https://images.unsplash.com/photo-1516321318423-f06f85e504b3?auto=format&fit=crop&w=1200&h=800&q=82",
          "alt": "回复中的 GIF 预览"
        }
      ],
      "publishedAt": "2026-08-31 19:05"
    }
  ],
  "postUrl": "https://example.com/reply/1"
}
